{
  "$ref": "#/definitions/categories",
  "definitions": {
    "categories": {
      "type": "object",
      "properties": {
        "name": {
          "type": "string"
        },
        "slug": {
          "type": "string"
        },
        "description": {
          "type": "string"
        },
        "seoTitle": {
          "type": "string"
        },
        "seoDescription": {
          "type": "string"
        },
        "heroImage": {
          "type": "string"
        },
        "seoContent": {
          "type": "string"
        },
        "featured": {
          "type": "boolean",
          "default": false
        },
        "order": {
          "type": "number",
          "default": 0
        },
        "$schema": {
          "type": "string"
        }
      },
      "required": [
        "name",
        "slug",
        "description",
        "seoTitle",
        "seoDescription"
      ],
      "additionalProperties": false
    }
  },
  "$schema": "http://json-schema.org/draft-07/schema#"
}