{
  "name": "Accessories",
  "slug": "accessories",
  "description": "Complete your setup with premium tech accessories - cases, chargers, cables, and more.",
  "seoTitle": "Tech Accessories - Cases, Chargers & More",
  "seoDescription": "Shop quality tech accessories including phone cases, laptop bags, chargers, cables, and peripherals at great prices.",
  "heroImage": "https://images.unsplash.com/photo-1583394838336-acd977736f90?w=1200&h=600&fit=crop",
  "seoContent": "Enhance your devices with our premium accessories collection. Find protective cases, fast chargers, durable cables, wireless earbuds, and more from trusted brands. All accessories are quality-tested for compatibility and durability.",
  "featured": true,
  "order": 3
}
